{
  "schemaVersion": 1,
  "productID": "lengyan",
  "platform": "android",
  "deliveryVersion": "planned-v1",
  "state": "planned",
  "artifactManifest": "audio-artifacts.json",
  "selectedRenditionID": null,
  "providers": [],
  "releaseBlockers": [
    "Select and verify a primary HTTPS host with byte-range resume in target regions.",
    "Benchmark AAC and Opus renditions on the Android device matrix before selecting a rendition.",
    "Confirm Android redistribution rights for the legacy recordings and record the approval evidence."
  ]
}
